{
  "intent_id": "agent-intent-1",
  "agent_session_id": "agent-session-fixture",
  "model_id": "fixture-model",
  "account_id": "fixture-local-paper",
  "authorization_id": "auth-fixture",
  "strategy_id": "official-fixture-strategy",
  "symbol": "AAPL.US",
  "side": "Buy",
  "quantity_or_notional": 5,
  "order_type": "Limit",
  "limit_price_optional": 190,
  "time_in_force": "Day",
  "outside_regular_hours": false,
  "reason": "Deterministic fixture proposal.",
  "confidence": 0.9,
  "created_at": "2026-01-05T09:31:00Z",
  "expires_at": "2026-01-05T09:36:00Z"
}
